SQL> select*from tab;

no rows selected

SQL> desc emp;
ERROR:
ORA-04043: object emp does not exist 


SQL> select sysdate from dual;

SYSDATE                                                                         
---------                                                                       
24-JUL-19                                                                       

SQL> create table cgdemo1(eno number);

Table created.

SQL> select*from tab;

TNAME                          TABTYPE  CLUSTERID                               
------------------------------ ------- ----------                               
CGDEMO1                        TABLE                                            

SQL> spool off
SQL> select*from tab;

TNAME                          TABTYPE  CLUSTERID                               
------------------------------ ------- ----------                               
CGDEMO1                        TABLE                                            

SQL> spool off
SQL> create table cgdept1(deptno number(4) primary key,
  2  dname varchar(20) not null,
  3  locid number(4));

Table created.

SQL> create table cgemp1(empno number(4) primary key,
  2  ename varchar(20) not null,
  3  esal number(6) check(esal>27000),
  4  deptno number(4) references cgdept1(deptno),
  5  email varchar(20) unique,
  6  jdate date);

Table created.

SQL> cerate table cgdept2(deptno number(4) constraint dnopk primary key,
SP2-0734: unknown command beginning "cerate tab..." - rest of line ignored.
SQL> create table cgdept2(deptno number(4) constraint dnopk primary key,
  2  dname varchar(20) constraint dnamenn not null,
  3  locid number(4));

Table created.

SQL> create table cgemp2(empno number(4) constraints enopk primary key,
  2  enamne varchar(20) constarints enamenn not null,
  3  esal number(6) constraints esalchk check(esal>27000),
  4  deptno number(4) constarints dnofk foreign key references cgdept2(deptno),
  5  email varcahr2(20) constarints emailunq unique,
  6  jdate date);
enamne varchar(20) constarints enamenn not null,
                   *
ERROR at line 2:
ORA-00907: missing right parenthesis 


SQL> cerate table cgdept2(deptno number(4) constraint dnopk primary key,
SP2-0734: unknown command beginning "cerate tab..." - rest of line ignored.
SQL> create table cgdept2(deptno number(4) constraint dnopk primary key,
  2  create table cgemp2(empno number(4) constraints enopk primary key,
  3  dname varchar(20) constraint dnamenn not null,
  4  
SQL> create table cgemp2(empno number(4) constraints enopk primary key,
  2  enamne varchar(20) constraints enamenn not null,
  3  esal number(6) constraints esalchk check(esal>27000),
  4  deptno number(4) constraints dnofk foreign key references cgdept2(deptno),
  5  email varcahr2(20) constraints emailunq unique,
  6  jdate date);
deptno number(4) constraints dnofk foreign key references cgdept2(deptno),
                 *
ERROR at line 4:
ORA-02253: constraint specification not allowed here 


SQL> create table cgemp2(empno number(4) constraints enopk primary key,
  2  deptno number(4) constraints dnofk foreign key references cgdept2(deptno),
  3  esal number(6) constraints esalchk check(esal>27000),
  4  
SQL> create table cgemp2(empno number(4) constraints enopk primary key,
  2  enamne varchar(20) constraints enamenn not null,
  3  esal number(6) constraints esalchk check(esal>27000),
  4  deptno number(4) constraints dnofk references cgdept2(deptno),
  5  email varcahr2(20) constraints emailunq unique,
  6  jdate date);
email varcahr2(20) constraints emailunq unique,
              *
ERROR at line 5:
ORA-00907: missing right parenthesis 


SQL> create table cgemp2(empno number(4) constraints enopk primary key,
  2  enamne varchar(20) constraints enamenn not null,
  3  esal number(6) constraints esalchk check(esal>27000),
  4  deptno number(4) constraints dnofk references cgdept2(deptno),
  5  email varchar2(20) constraints emailunq unique,
  6  jdate date);

Table created.

SQL> craete table cgdept3(deptno number(4), dname varchar2(20) not null, locid number(4),primary key(deptno));
SP2-0734: unknown command beginning "craete tab..." - rest of line ignored.
SQL> create table cgdept3(deptno number(4), dname varchar2(20) not null, locid number(4),primary key(deptno));

Table created.

SQL> create table cgemp3(empno number(4),ename varchar2(20) not null,esal number(6).deptno number(4),email varchar2(20),jdate date,
  2  primary key(empno),
  3  check(esal>27000),
  4  foreign key(deptno references cgdept3(deptno),
  5  unique(email));
create table cgemp3(empno number(4),ename varchar2(20) not null,esal number(6).deptno number(4),email varchar2(20),jdate date,
                                                                              *
ERROR at line 1:
ORA-00907: missing right parenthesis 


SQL> create table cgemp3(empno number(4), ename varchar2(20) not null, esal number(6), deptno number(4), email varchar2(20), jdate date,
  2  primary key(empno),
  3  check(esal>27000),
  4  foreign key(deptno references cgdept3(deptno),
  5  unique(email));
foreign key(deptno references cgdept3(deptno),
                   *
ERROR at line 4:
ORA-00907: missing right parenthesis 


SQL> create table cgemp3(empno number(4), ename varchar2(20) not null, esal number(6), deptno number(4), email varchar2(20), jdate date,
  2  primary key(empno),
  3  check(esal>27000),
  4  foreign key(deptno references cgdept3(deptno)),
  5  unique(email));
foreign key(deptno references cgdept3(deptno)),
                   *
ERROR at line 4:
ORA-00907: missing right parenthesis 


SQL> create table cgemp3(empno number(4), ename varchar2(20) not null, esal number(6), deptno number(4), email varchar2(20), jdate date,
  2  primary key(empno),
  3  check(esal>27000),
  4  foreign key(deptno) references cgdept3(deptno),
  5  unique(email));

Table created.

SQL> create table cgdept4(deptno number(4),
  2  dname varchar2(20) constraint dnamenn4 not null,
  3  locid number(4),
  4  constraint dnopk4 primarykey(deptno));
constraint dnopk4 primarykey(deptno))
                            *
ERROR at line 4:
ORA-00902: invalid datatype 


SQL> create table cgdept4(deptno number(4),
  2  dname varchar2(20) constraint dnamenn4 not null,
  3  locid number(4),
  4  constraint dnopk4 primary key(deptno));

Table created.

SQL> create table cgemp4(empno number(4), ename varchar2(20) constraint enamenn4 not null, esal number(6), deptno number(4), email varchar2(20), jdate date,
  2  constraint enopk4 primary key(empno),
  3  constraint esalchk4 check(esal>27000),
  4  constarint dnofk4 foreign key (deptno) references cgdept4(deptno).
  5  constraint emailunq4 unique(email));
constarint dnofk4 foreign key (deptno) references cgdept4(deptno).
                  *
ERROR at line 4:
ORA-00907: missing right parenthesis 


SQL> create table cgemp4(empno number(4), ename varchar2(20) constraint enamenn4 not null, esal number(6), deptno number(4), email varchar2(20), jdate date,
  2  constraint enopk4 primary key(empno),
  3  constraint esalchk4 check(esal>27000),
  4  constraint dnofk4 foreign key (deptno) references cgdept4(deptno).
  5  constraint emailunq4 unique(email));
constraint dnofk4 foreign key (deptno) references cgdept4(deptno).
                                                                 *
ERROR at line 4:
ORA-00907: missing right parenthesis 


SQL> create table cgemp4(empno number(4), ename varchar2(20) constraint enamenn4 not null, esal number(6), deptno number(4), email varchar2(20), jdate date,
  2  constraint enopk4 primary key(empno),
  3  constraint esalchk4 check(esal>27000),
  4  constraint dnofk4 foreign key (deptno) references cgdept4(deptno),
  5  constraint emailunq4 unique(email));

Table created.

SQL> desc cgdept1
 Name                                      Null?    Type
 ----------------------------------------- -------- ----------------------------
 DEPTNO                                    NOT NULL NUMBER(4)
 DNAME                                     NOT NULL VARCHAR2(20)
 LOCID                                              NUMBER(4)

SQL> cgemp1
SP2-0042: unknown command "cgemp1" - rest of line ignored.
SQL> desc cgemp1
 Name                                      Null?    Type
 ----------------------------------------- -------- ----------------------------
 EMPNO                                     NOT NULL NUMBER(4)
 ENAME                                     NOT NULL VARCHAR2(20)
 ESAL                                               NUMBER(6)
 DEPTNO                                             NUMBER(4)
 EMAIL                                              VARCHAR2(20)
 JDATE                                              DATE

SQL> desc cgdept2
 Name                                      Null?    Type
 ----------------------------------------- -------- ----------------------------
 DEPTNO                                    NOT NULL NUMBER(4)
 DNAME                                     NOT NULL VARCHAR2(20)
 LOCID                                              NUMBER(4)

SQL> desc cgemp2
 Name                                      Null?    Type
 ----------------------------------------- -------- ----------------------------
 EMPNO                                     NOT NULL NUMBER(4)
 ENAMNE                                    NOT NULL VARCHAR2(20)
 ESAL                                               NUMBER(6)
 DEPTNO                                             NUMBER(4)
 EMAIL                                              VARCHAR2(20)
 JDATE                                              DATE

SQL> desc cgdept3
 Name                                      Null?    Type
 ----------------------------------------- -------- ----------------------------
 DEPTNO                                    NOT NULL NUMBER(4)
 DNAME                                     NOT NULL VARCHAR2(20)
 LOCID                                              NUMBER(4)

SQL> desc cgemp3
 Name                                      Null?    Type
 ----------------------------------------- -------- ----------------------------
 EMPNO                                     NOT NULL NUMBER(4)
 ENAME                                     NOT NULL VARCHAR2(20)
 ESAL                                               NUMBER(6)
 DEPTNO                                             NUMBER(4)
 EMAIL                                              VARCHAR2(20)
 JDATE                                              DATE

SQL> desc cgdept4
 Name                                      Null?    Type
 ----------------------------------------- -------- ----------------------------
 DEPTNO                                    NOT NULL NUMBER(4)
 DNAME                                     NOT NULL VARCHAR2(20)
 LOCID                                              NUMBER(4)

SQL> desc cgemp4
 Name                                      Null?    Type
 ----------------------------------------- -------- ----------------------------
 EMPNO                                     NOT NULL NUMBER(4)
 ENAME                                     NOT NULL VARCHAR2(20)
 ESAL                                               NUMBER(6)
 DEPTNO                                             NUMBER(4)
 EMAIL                                              VARCHAR2(20)
 JDATE                                              DATE

SQL> spool off
SQL> spool c:/sql_naman/sqlnotes.txt append
SQL> create table altdemocg(eno number(3),
  2  ename varchar2(20));

Table created.

SQL> desc altdemocg;
 Name                                      Null?    Type
 ----------------------------------------- -------- ----------------------------
 ENO                                                NUMBER(3)
 ENAME                                              VARCHAR2(20)

SQL> alter table altdemocg
  2  add( jdate date, address varchar2(20),
  3  email varchar2(20));

Table altered.

SQL> desc altdemocg
 Name                                      Null?    Type
 ----------------------------------------- -------- ----------------------------
 ENO                                                NUMBER(3)
 ENAME                                              VARCHAR2(20)
 JDATE                                              DATE
 ADDRESS                                            VARCHAR2(20)
 EMAIL                                              VARCHAR2(20)

SQL> alter table altdemocg drop column email;

Table altered.

SQL> desc altdemocg
 Name                                      Null?    Type
 ----------------------------------------- -------- ----------------------------
 ENO                                                NUMBER(3)
 ENAME                                              VARCHAR2(20)
 JDATE                                              DATE
 ADDRESS                                            VARCHAR2(20)

SQL> alter table altdemocg modify(eno number(6));

Table altered.

SQL> desc altdemocg
 Name                                      Null?    Type
 ----------------------------------------- -------- ----------------------------
 ENO                                                NUMBER(6)
 ENAME                                              VARCHAR2(20)
 JDATE                                              DATE
 ADDRESS                                            VARCHAR2(20)

SQL> alter table altdemocg rename(eno to empno));
alter table altdemocg rename(eno to empno))
                            *
ERROR at line 1:
ORA-14155: missing PARTITION or SUBPARTITION keyword 


SQL> alter table altdemocg rename(eno to empno);
alter table altdemocg rename(eno to empno)
                            *
ERROR at line 1:
ORA-14155: missing PARTITION or SUBPARTITION keyword 


SQL> alter table altdemocg rename column eno to empno;

Table altered.

SQL> alter table altdemocg modify (jdate to timestamp);
alter table altdemocg modify (jdate to timestamp)
                                    *
ERROR at line 1:
ORA-00902: invalid datatype 


SQL> alter table altdemocg modify (jdate timestamp);

Table altered.

SQL> alter table altdemocg add constraint eno_pckgdemo primary key(empno);

Table altered.

SQL> desc altdeocg
ERROR:
ORA-04043: object altdeocg does not exist 


SQL> desc altdemocg
 Name                                      Null?    Type
 ----------------------------------------- -------- ----------------------------
 EMPNO                                     NOT NULL NUMBER(6)
 ENAME                                              VARCHAR2(20)
 JDATE                                              TIMESTAMP(6)
 ADDRESS                                            VARCHAR2(20)

SQL> alter table altdemocg modify (ename not null);

Table altered.

SQL> desc altdemocg
 Name                                      Null?    Type
 ----------------------------------------- -------- ----------------------------
 EMPNO                                     NOT NULL NUMBER(6)
 ENAME                                     NOT NULL VARCHAR2(20)
 JDATE                                              TIMESTAMP(6)
 ADDRESS                                            VARCHAR2(20)

SQL> alter table altdemocg add(col1 number(4), col2 number(4));

Table altered.

SQL> desc altdemocg
 Name                                      Null?    Type
 ----------------------------------------- -------- ----------------------------
 EMPNO                                     NOT NULL NUMBER(6)
 ENAME                                     NOT NULL VARCHAR2(20)
 JDATE                                              TIMESTAMP(6)
 ADDRESS                                            VARCHAR2(20)
 COL1                                               NUMBER(4)
 COL2                                               NUMBER(4)

SQL> alter table altdemocg set unused column col2;

Table altered.

SQL> desc altdemocg
 Name                                      Null?    Type
 ----------------------------------------- -------- ----------------------------
 EMPNO                                     NOT NULL NUMBER(6)
 ENAME                                     NOT NULL VARCHAR2(20)
 JDATE                                              TIMESTAMP(6)
 ADDRESS                                            VARCHAR2(20)
 COL1                                               NUMBER(4)

SQL> alter table altdemocg drop column col2;
alter table altdemocg drop column col2
                                  *
ERROR at line 1:
ORA-00904: "COL2": invalid identifier 


SQL> alter table altdemocg drop unused column;

Table altered.

SQL> alter table altdemocg drop column col1;

Table altered.

SQL> desc altdemocg
 Name                                      Null?    Type
 ----------------------------------------- -------- ----------------------------
 EMPNO                                     NOT NULL NUMBER(6)
 ENAME                                     NOT NULL VARCHAR2(20)
 JDATE                                              TIMESTAMP(6)
 ADDRESS                                            VARCHAR2(20)

SQL> alter table altdemocg add(col1 number(4));

Table altered.

SQL> desc altdemocg
 Name                                      Null?    Type
 ----------------------------------------- -------- ----------------------------
 EMPNO                                     NOT NULL NUMBER(6)
 ENAME                                     NOT NULL VARCHAR2(20)
 JDATE                                              TIMESTAMP(6)
 ADDRESS                                            VARCHAR2(20)
 COL1                                               NUMBER(4)

SQL> alter table altdemocg drop constraint eno_pkcgdemo;
alter table altdemocg drop constraint eno_pkcgdemo
                                      *
ERROR at line 1:
ORA-02443: Cannot drop constraint  - nonexistent constraint 


SQL> alter table altdemocg drop constraint eno_pckgdemo;

Table altered.

SQL> desc altdemocg
 Name                                      Null?    Type
 ----------------------------------------- -------- ----------------------------
 EMPNO                                              NUMBER(6)
 ENAME                                     NOT NULL VARCHAR2(20)
 JDATE                                              TIMESTAMP(6)
 ADDRESS                                            VARCHAR2(20)
 COL1                                               NUMBER(4)

SQL> rename altdemocg to newdemo;

Table renamed.

SQL> desc newdemo
 Name                                      Null?    Type
 ----------------------------------------- -------- ----------------------------
 EMPNO                                              NUMBER(6)
 ENAME                                     NOT NULL VARCHAR2(20)
 JDATE                                              TIMESTAMP(6)
 ADDRESS                                            VARCHAR2(20)
 COL1                                               NUMBER(4)

SQL> insert into newdemo values(1101,'jony','12-jan-2012','delhi',998);

1 row created.

SQL> insert into newdemo values(1102,'james','12-feb-2012','hyd',989);

1 row created.

SQL> commit
  2  select *from newdemo;
select *from newdemo
*
ERROR at line 2:
ORA-02185: a token other than WORK follows COMMIT 


SQL> select *from newdemo
  2  
SQL> select * from newdemo;

     EMPNO ENAME                                                                
---------- --------------------                                                 
JDATE                                                                           
---------------------------------------------------------------------------     
ADDRESS                    COL1                                                 
-------------------- ----------                                                 
      1101 jony                                                                 
12-JAN-20 12.00.00.000000 PM                                                    
delhi                       998                                                 
                                                                                
      1102 james                                                                
12-FEB-20 12.00.00.000000 PM                                                    
hyd                         989                                                 

     EMPNO ENAME                                                                
---------- --------------------                                                 
JDATE                                                                           
---------------------------------------------------------------------------     
ADDRESS                    COL1                                                 
-------------------- ----------                                                 
                                                                                

SQL> truncate table newdemo;

Table truncated.

SQL> 
SQL> select * from newdemo;

no rows selected

SQL> desc newdemo
 Name                                      Null?    Type
 ----------------------------------------- -------- ----------------------------
 EMPNO                                              NUMBER(6)
 ENAME                                     NOT NULL VARCHAR2(20)
 JDATE                                              TIMESTAMP(6)
 ADDRESS                                            VARCHAR2(20)
 COL1                                               NUMBER(4)

SQL> drop table newdemo;

Table dropped.

SQL> desc newdemo
ERROR:
ORA-04043: object newdemo does not exist 


SQL> select * from tab;

TNAME                          TABTYPE  CLUSTERID                               
------------------------------ ------- ----------                               
CGDEMO1                        TABLE                                            
CGDEPT1                        TABLE                                            
CGDEPT2                        TABLE                                            
CGDEPT3                        TABLE                                            
CGDEPT4                        TABLE                                            
CGEMP1                         TABLE                                            
CGEMP2                         TABLE                                            
CGEMP3                         TABLE                                            
CGEMP4                         TABLE                                            

9 rows selected.

SQL> flashback table newdemo to before drop;
flashback table newdemo to before drop
*
ERROR at line 1:
ORA-38305: object not in RECYCLE BIN 


SQL> create table dmldemocg(empno number(4), ename varchar2(20), esal number(6), deptno number(
  2  
SQL> create table dmldemocg(empno number(4), ename varchar2(20), esal number(6), deptno number(4),jadate date);

Table created.

SQL> clr scr
SP2-0042: unknown command "clr scr" - rest of line ignored.
SQL> cle scr

SQL> create table dmldemocg(empno number(4), ename varchar2(20), esal number(6), deptno number(4),jadate date);
create table dmldemocg(empno number(4), ename varchar2(20), esal number(6), deptno number(4),jadate date)
             *
ERROR at line 1:
ORA-00955: name is already used by an existing object 


SQL> clescr
SP2-0042: unknown command "clescr" - rest of line ignored.
SQL> cle scr

SQL> insert into dmldemocg values(1101,'varma',1200,10,'12-jan-2010');

1 row created.

SQL> insert into dmldemocg values(1102,'sharma',1300,10,'13-feb-2010');

1 row created.

SQL> insert into dmldemocg values(1102,nll,null,20,null);
insert into dmldemocg values(1102,nll,null,20,null)
                                  *
ERROR at line 1:
ORA-00984: column not allowed here 


SQL> insert into dmldemocg values(1103,nll,null,20,null);
insert into dmldemocg values(1103,nll,null,20,null)
                                  *
ERROR at line 1:
ORA-00984: column not allowed here 


SQL> insert into dmldemocg values(1103,null,null,20,null);

1 row created.

SQL> insert into dmldemocg values(1104,'bond',1500,30,null);

1 row created.

SQL> commit
  2  commit;
commit
*
ERROR at line 2:
ORA-02185: a token other than WORK follows COMMIT 


SQL> 
SQL> commit;

Commit complete.

SQL> select*from dmldemocg;

     EMPNO ENAME                      ESAL     DEPTNO JADATE                    
---------- -------------------- ---------- ---------- ---------                 
      1101 varma                      1200         10 12-JAN-10                 
      1102 sharma                     1300         10 13-FEB-10                 
      1103                                         20                           
      1104 bond                       1500         30                           

SQL> insert into dmldemocg (empno, esal, jdate) values(1106,1600,'12-may-2012);
ERROR:
ORA-01756: quoted string not properly terminated 


SQL> insert into dmldemocg (empno, esal, jdate) values(1106,1600,'12-may-2012');
insert into dmldemocg (empno, esal, jdate) values(1106,1600,'12-may-2012')
                                    *
ERROR at line 1:
ORA-00904: "JDATE": invalid identifier 


SQL> insert into dmldemocg (empno, esal, jadate) values(1106,1600,'12-may-2012');

1 row created.

SQL> insert into dmldemocg (empno, esal, jadate) values(1107,1700,'23-dec-2012');

1 row created.

SQL> commit
  2  
SQL> commit;

Commit complete.

SQL> insert into dmldemocg values(&empno,.&ename',&esal,&deptno,'&jadate');
Enter value for empno: 2001
Enter value for ename: naveen
Enter value for esal: 12000
Enter value for deptno: 40
Enter value for jadate: 12-dec-2017
old   1: insert into dmldemocg values(&empno,.&ename',&esal,&deptno,'&jadate')
new   1: insert into dmldemocg values(2001,.naveen',12000,40,'12-dec-2017')
ERROR:
ORA-01756: quoted string not properly terminated 


SQL> insert into dmldemocg values(&empno,'&ename',&esal,&deptno,'&jadate');
Enter value for empno: 2001
Enter value for ename: naveen
Enter value for esal: 12000
Enter value for deptno: 40
Enter value for jadate: 12-dec-2017
old   1: insert into dmldemocg values(&empno,'&ename',&esal,&deptno,'&jadate')
new   1: insert into dmldemocg values(2001,'naveen',12000,40,'12-dec-2017')

1 row created.

SQL> /
Enter value for empno: 2002
Enter value for ename: naman
Enter value for esal: 13000
Enter value for deptno: 40
Enter value for jadate: 12-may-2017
old   1: insert into dmldemocg values(&empno,'&ename',&esal,&deptno,'&jadate')
new   1: insert into dmldemocg values(2002,'naman',13000,40,'12-may-2017')

1 row created.

SQL> /
Enter value for empno: 
Enter value for ename: 
Enter value for esal: 
Enter value for deptno: 
Enter value for jadate: 
old   1: insert into dmldemocg values(&empno,'&ename',&esal,&deptno,'&jadate')
new   1: insert into dmldemocg values(,'',,,'')
insert into dmldemocg values(,'',,,'')
                             *
ERROR at line 1:
ORA-00936: missing expression 


SQL> alter table dmldemocg rename column jadate to jdate;

Table altered.

SQL> desc dmldemocg
 Name                                      Null?    Type
 ----------------------------------------- -------- ----------------------------
 EMPNO                                              NUMBER(4)
 ENAME                                              VARCHAR2(20)
 ESAL                                               NUMBER(6)
 DEPTNO                                             NUMBER(4)
 JDATE                                              DATE

SQL> /
alter table dmldemocg rename column jadate to jdate
*
ERROR at line 1:
ORA-00957: duplicate column name 


SQL> insert into dmldemocg values(&empno,'&ename',&esal,&deptno,'&jadate');
Enter value for empno: 22
Enter value for ename: naaaa
Enter value for esal: 20000
Enter value for deptno: 30
Enter value for jadate: 12-may-2222
old   1: insert into dmldemocg values(&empno,'&ename',&esal,&deptno,'&jadate')
new   1: insert into dmldemocg values(22,'naaaa',20000,30,'12-may-2222')

1 row created.

SQL> select*from dmldemocg
  2  
SQL> select*from dmldemocg;

     EMPNO ENAME                      ESAL     DEPTNO JDATE                     
---------- -------------------- ---------- ---------- ---------                 
      1101 varma                      1200         10 12-JAN-10                 
      1102 sharma                     1300         10 13-FEB-10                 
      1103                                         20                           
      1104 bond                       1500         30                           
      1106                            1600            12-MAY-12                 
      1107                            1700            23-DEC-12                 
      2001 naveen                    12000         40 12-DEC-17                 
      2002 naman                     13000         40 12-MAY-17                 
        22 naaaa                     20000         30 12-MAY-22                 

9 rows selected.

SQL> update dmldemocg
  2  set ename='rohit' , esal=14000,      jdate='18-jan-2016'
  3  where empno=1103
  4  
SQL> update dmldemocg
  2  set ename='rohit' , esal=14000,      jdate='18-jan-2016'
  3  * where empno=1103
  4  
SQL> update dmldemocg
  2  set ename='rohit' , esal=14000,      jdate='18-jan-2016'
  3  where empno=1103;

1 row updated.

SQL> select * from dmldemocg;

     EMPNO ENAME                      ESAL     DEPTNO JDATE                     
---------- -------------------- ---------- ---------- ---------                 
      1101 varma                      1200         10 12-JAN-10                 
      1102 sharma                     1300         10 13-FEB-10                 
      1103 rohit                     14000         20 18-JAN-16                 
      1104 bond                       1500         30                           
      1106                            1600            12-MAY-12                 
      1107                            1700            23-DEC-12                 
      2001 naveen                    12000         40 12-DEC-17                 
      2002 naman                     13000         40 12-MAY-17                 
        22 naaaa                     20000         30 12-MAY-22                 

9 rows selected.

SQL> commit;

Commit complete.

SQL> delete from dmldemocg
  2  where deptno=10;

2 rows deleted.

SQL> select * from dmldemocg;

     EMPNO ENAME                      ESAL     DEPTNO JDATE                     
---------- -------------------- ---------- ---------- ---------                 
      1103 rohit                     14000         20 18-JAN-16                 
      1104 bond                       1500         30                           
      1106                            1600            12-MAY-12                 
      1107                            1700            23-DEC-12                 
      2001 naveen                    12000         40 12-DEC-17                 
      2002 naman                     13000         40 12-MAY-17                 
        22 naaaa                     20000         30 12-MAY-22                 

7 rows selected.

SQL> delete from dmldemocg
  2  where empno=22;

1 row deleted.

SQL> select * from dmldemocg;

     EMPNO ENAME                      ESAL     DEPTNO JDATE                     
---------- -------------------- ---------- ---------- ---------                 
      1103 rohit                     14000         20 18-JAN-16                 
      1104 bond                       1500         30                           
      1106                            1600            12-MAY-12                 
      1107                            1700            23-DEC-12                 
      2001 naveen                    12000         40 12-DEC-17                 
      2002 naman                     13000         40 12-MAY-17                 

6 rows selected.

SQL> delete from dmldemocg
  2  where ename=null;

0 rows deleted.

SQL> delete from dmldemocg
  2  where ename is null;

2 rows deleted.

SQL> create table mempcg
  2  (empno number(4), ename varchar2(20), esal number(6), deptno number(4));

Table created.

SQL> insert into mempcg values(1101, 'james',1000,10);

1 row created.

SQL> insert into mempcg values(1102, 'bond',5600,10);

1 row created.

SQL> insert into mempcg values(1103, 'verma',2300,20);

1 row created.

SQL> insert into mempcg values(1104, 'sharma',3210,20);

1 row created.

SQL> insert into mempcg values(1105, 'vikram',5400,30);

1 row created.

SQL> insert into mempcg values(1106, 'ravi',6600,30);

1 row created.

SQL> commit;

Commit complete.

SQL> select*from mempcg;

     EMPNO ENAME                      ESAL     DEPTNO                           
---------- -------------------- ---------- ----------                           
      1101 james                      1000         10                           
      1102 bond                       5600         10                           
      1103 verma                      2300         20                           
      1104 sharma                     3210         20                           
      1105 vikram                     5400         30                           
      1106 ravi                       6600         30                           

6 rows selected.

SQL> spoon on
SP2-0042: unknown command "spoon on" - rest of line ignored.
SQL> spoon on;
SP2-0042: unknown command "spoon on" - rest of line ignored.
SQL> spool on
SQL> create table nvldemo( empno number(4), ename varchar2(20), esal number(6), deptno number(2), comm1 number(4), comm2 number(4), comm3 number(4));

Table created.

SQL> insert into nvldemo values(&empno, '&ename', &esal, &deptno, &comm1, &comm2, &comm3);
Enter value for empno: 1101
Enter value for ename: scott
Enter value for esal: 29000
Enter value for deptno: 10
Enter value for comm1: null
Enter value for comm2: null
Enter value for comm3: null
old   1: insert into nvldemo values(&empno, '&ename', &esal, &deptno, &comm1, &comm2, &comm3)
new   1: insert into nvldemo values(1101, 'scott', 29000, 10, null, null, null)

1 row created.

SQL> /
Enter value for empno: 1102
Enter value for ename: miller
Enter value for esal: 22000
Enter value for deptno: 10
Enter value for comm1: 101
Enter value for comm2: 102
Enter value for comm3: 103
old   1: insert into nvldemo values(&empno, '&ename', &esal, &deptno, &comm1, &comm2, &comm3)
new   1: insert into nvldemo values(1102, 'miller', 22000, 10, 101, 102, 103)

1 row created.

SQL> /
Enter value for empno: 1103
Enter value for ename: sharma
Enter value for esal: 21000
Enter value for deptno: 10
Enter value for comm1: 101
Enter value for comm2: null
Enter value for comm3: 103
old   1: insert into nvldemo values(&empno, '&ename', &esal, &deptno, &comm1, &comm2, &comm3)
new   1: insert into nvldemo values(1103, 'sharma', 21000, 10, 101, null, 103)

1 row created.

SQL> /
Enter value for empno: varma
Enter value for ename: 19000
Enter value for esal: 20
Enter value for deptno: .
Enter value for comm1: \
Enter value for comm2: .
Enter value for comm3: .
old   1: insert into nvldemo values(&empno, '&ename', &esal, &deptno, &comm1, &comm2, &comm3)
new   1: insert into nvldemo values(varma, '19000', 20, ., \, ., .)
insert into nvldemo values(varma, '19000', 20, ., \, ., .)
                                               *
ERROR at line 1:
ORA-00936: missing expression 


SQL> /
Enter value for empno: 1104
Enter value for ename: varma
Enter value for esal: 19000
Enter value for deptno: 20
Enter value for comm1: null
Enter value for comm2: 102
Enter value for comm3: 103
old   1: insert into nvldemo values(&empno, '&ename', &esal, &deptno, &comm1, &comm2, &comm3)
new   1: insert into nvldemo values(1104, 'varma', 19000, 20, null, 102, 103)

1 row created.

SQL> /
Enter value for empno: 1105
Enter value for ename: ravi
Enter value for esal: 28000
Enter value for deptno: 20
Enter value for comm1: null
Enter value for comm2: null
Enter value for comm3: 103
old   1: insert into nvldemo values(&empno, '&ename', &esal, &deptno, &comm1, &comm2, &comm3)
new   1: insert into nvldemo values(1105, 'ravi', 28000, 20, null, null, 103)

1 row created.

SQL> /
Enter value for empno: 1106
Enter value for ename: tom
Enter value for esal: 12000
Enter value for deptno: 30
Enter value for comm1: null
Enter value for comm2: null
Enter value for comm3: null
old   1: insert into nvldemo values(&empno, '&ename', &esal, &deptno, &comm1, &comm2, &comm3)
new   1: insert into nvldemo values(1106, 'tom', 12000, 30, null, null, null)

1 row created.

SQL> /
Enter value for empno: 1107
Enter value for ename: jerry
Enter value for esal: 22000
Enter value for deptno: 30
Enter value for comm1: null
Enter value for comm2: 102
Enter value for comm3: 103
old   1: insert into nvldemo values(&empno, '&ename', &esal, &deptno, &comm1, &comm2, &comm3)
new   1: insert into nvldemo values(1107, 'jerry', 22000, 30, null, 102, 103)

1 row created.

SQL> /
Enter value for empno: 1108
Enter value for ename: kims
Enter value for esal: 34000
Enter value for deptno: 40
Enter value for comm1: 101
Enter value for comm2: null
Enter value for comm3: null
old   1: insert into nvldemo values(&empno, '&ename', &esal, &deptno, &comm1, &comm2, &comm3)
new   1: insert into nvldemo values(1108, 'kims', 34000, 40, 101, null, null)

1 row created.

SQL> select *from nvl demo
  2  
SQL> select *from nvl demo;
select *from nvl demo
             *
ERROR at line 1:
ORA-00942: table or view does not exist 


SQL> select *from nvldemo;

     EMPNO ENAME                      ESAL     DEPTNO      COMM1      COMM2     
---------- -------------------- ---------- ---------- ---------- ----------     
     COMM3                                                                      
----------                                                                      
      1101 scott                     29000         10                           
                                                                                
                                                                                
      1102 miller                    22000         10        101        102     
       103                                                                      
                                                                                
      1103 sharma                    21000         10        101                
       103                                                                      
                                                                                

     EMPNO ENAME                      ESAL     DEPTNO      COMM1      COMM2     
---------- -------------------- ---------- ---------- ---------- ----------     
     COMM3                                                                      
----------                                                                      
      1104 varma                     19000         20                   102     
       103                                                                      
                                                                                
      1105 ravi                      28000         20                           
       103                                                                      
                                                                                
      1106 tom                       12000         30                           
                                                                                
                                                                                

     EMPNO ENAME                      ESAL     DEPTNO      COMM1      COMM2     
---------- -------------------- ---------- ---------- ---------- ----------     
     COMM3                                                                      
----------                                                                      
      1107 jerry                     22000         30                   102     
       103                                                                      
                                                                                
      1108 kims                      34000         40        101                
                                                                                
                                                                                

8 rows selected.

SQL> commit
  2  
SQL> commit;

Commit complete.

SQL> delete from nvldemo
  2  where empno=1108;

1 row deleted.

SQL> select *from nvldemo;

     EMPNO ENAME                      ESAL     DEPTNO      COMM1      COMM2     
---------- -------------------- ---------- ---------- ---------- ----------     
     COMM3                                                                      
----------                                                                      
      1101 scott                     29000         10                           
                                                                                
                                                                                
      1102 miller                    22000         10        101        102     
       103                                                                      
                                                                                
      1103 sharma                    21000         10        101                
       103                                                                      
                                                                                

     EMPNO ENAME                      ESAL     DEPTNO      COMM1      COMM2     
---------- -------------------- ---------- ---------- ---------- ----------     
     COMM3                                                                      
----------                                                                      
      1104 varma                     19000         20                   102     
       103                                                                      
                                                                                
      1105 ravi                      28000         20                           
       103                                                                      
                                                                                
      1106 tom                       12000         30                           
                                                                                
                                                                                

     EMPNO ENAME                      ESAL     DEPTNO      COMM1      COMM2     
---------- -------------------- ---------- ---------- ---------- ----------     
     COMM3                                                                      
----------                                                                      
      1107 jerry                     22000         30                   102     
       103                                                                      
                                                                                

7 rows selected.

SQL> /

     EMPNO ENAME                      ESAL     DEPTNO      COMM1      COMM2     
---------- -------------------- ---------- ---------- ---------- ----------     
     COMM3                                                                      
----------                                                                      
      1101 scott                     29000         10                           
                                                                                
                                                                                
      1102 miller                    22000         10        101        102     
       103                                                                      
                                                                                
      1103 sharma                    21000         10        101                
       103                                                                      
                                                                                

     EMPNO ENAME                      ESAL     DEPTNO      COMM1      COMM2     
---------- -------------------- ---------- ---------- ---------- ----------     
     COMM3                                                                      
----------                                                                      
      1104 varma                     19000         20                   102     
       103                                                                      
                                                                                
      1105 ravi                      28000         20                           
       103                                                                      
                                                                                
      1106 tom                       12000         30                           
                                                                                
                                                                                

     EMPNO ENAME                      ESAL     DEPTNO      COMM1      COMM2     
---------- -------------------- ---------- ---------- ---------- ----------     
     COMM3                                                                      
----------                                                                      
      1107 jerry                     22000         30                   102     
       103                                                                      
                                                                                

7 rows selected.

SQL> /

     EMPNO ENAME                      ESAL     DEPTNO      COMM1      COMM2     
---------- -------------------- ---------- ---------- ---------- ----------     
     COMM3                                                                      
----------                                                                      
      1101 scott                     29000         10                           
                                                                                
                                                                                
      1102 miller                    22000         10        101        102     
       103                                                                      
                                                                                
      1103 sharma                    21000         10        101                
       103                                                                      
                                                                                

     EMPNO ENAME                      ESAL     DEPTNO      COMM1      COMM2     
---------- -------------------- ---------- ---------- ---------- ----------     
     COMM3                                                                      
----------                                                                      
      1104 varma                     19000         20                   102     
       103                                                                      
                                                                                
      1105 ravi                      28000         20                           
       103                                                                      
                                                                                
      1106 tom                       12000         30                           
                                                                                
                                                                                

     EMPNO ENAME                      ESAL     DEPTNO      COMM1      COMM2     
---------- -------------------- ---------- ---------- ---------- ----------     
     COMM3                                                                      
----------                                                                      
      1107 jerry                     22000         30                   102     
       103                                                                      
                                                                                

7 rows selected.

SQL> insert into nvldemo values(1108,'kims',34000,40,101,null,null);

1 row created.

SQL> select*from nvldemo;

     EMPNO ENAME                      ESAL     DEPTNO      COMM1      COMM2     
---------- -------------------- ---------- ---------- ---------- ----------     
     COMM3                                                                      
----------                                                                      
      1101 scott                     29000         10                           
                                                                                
                                                                                
      1102 miller                    22000         10        101        102     
       103                                                                      
                                                                                
      1103 sharma                    21000         10        101                
       103                                                                      
                                                                                

     EMPNO ENAME                      ESAL     DEPTNO      COMM1      COMM2     
---------- -------------------- ---------- ---------- ---------- ----------     
     COMM3                                                                      
----------                                                                      
      1104 varma                     19000         20                   102     
       103                                                                      
                                                                                
      1105 ravi                      28000         20                           
       103                                                                      
                                                                                
      1106 tom                       12000         30                           
                                                                                
                                                                                

     EMPNO ENAME                      ESAL     DEPTNO      COMM1      COMM2     
---------- -------------------- ---------- ---------- ---------- ----------     
     COMM3                                                                      
----------                                                                      
      1107 jerry                     22000         30                   102     
       103                                                                      
                                                                                
      1108 kims                      34000         40        101                
                                                                                
                                                                                

8 rows selected.

SQL> commit;

Commit complete.

SQL> set lines 120
SQL> 
SQL> set lines 120;
SQL> select*from nvldemo;

     EMPNO ENAME                      ESAL     DEPTNO      COMM1      COMM2      COMM3                                  
---------- -------------------- ---------- ---------- ---------- ---------- ----------                                  
      1101 scott                     29000         10                                                                   
      1102 miller                    22000         10        101        102        103                                  
      1103 sharma                    21000         10        101                   103                                  
      1104 varma                     19000         20                   102        103                                  
      1105 ravi                      28000         20                              103                                  
      1106 tom                       12000         30                                                                   
      1107 jerry                     22000         30                   102        103                                  
      1108 kims                      34000         40        101                                                        

8 rows selected.

SQL> cle scr;

SQL> spool off;
